{
  "timestamp": "20251125_232547",
  "prompt": "LIVE_SYSTEM_PROMPT",
  "horse_data": {
    "rasse": "Deutsches Sportpferd",
    "alter": 4,
    "geschlecht": "Stute",
    "abstammung": "Bernay x London Swing",
    "stockmass": 170,
    "ausbildung": "angeritten",
    "haupteignung": "Dressur",
    "standort": "70619",
    "aku": "AKU ohne Befund",
    "erfolge": "Stutenleistungsprüfung 7,4",
    "charakter": "Brav und rittig",
    "besonderheiten": "verladefromm, schmiedefromm, unerschrocken"
  },
  "results": {
    "opus-4.5": {
      "content": "### Zusammenfassung\n\n**Geschätzter Marktwert: 18.000 - 25.000 €**\n\nDiese vierjährige Deutsche Sportpferd-Stute präsentiert sich als vielversprechende Dressurnachwuchsstute mit solider Abstammung und überdurchschnittlichem Stutenleistungsprüfungsergebnis. Die Kombination aus befundfreier AKU, korrektem Interieur und einem Stockmaß von 170 cm macht sie zu einer attraktiven Option für ambitionierte Amateure oder als Basis für ein professionelles Ausbildungsprojekt.\n\n---\n\n### Marktwertanalyse\n\n**Detaillierte Preisspannen-Erklärung:**\n\n**Untere Preisgrenze (18.000 €):** Diese konservative Schätzung berücksichtigt, dass die Stute erst angeritten ist und noch keine Turniererfolge vorweisen kann. Der Käufer übernimmt das volle Ausbildungsrisiko und muss mit weiteren 12-18 Monaten professioneller Ausbildung rechnen, bevor erste Turnierstart möglich sind. Bei einem Direktverkauf ohne aufwendige Vermarktung oder bei schnellem Verkaufswunsch ist dieser Preis realistisch.\n\n**Obere Preisgrenze (25.000 €):** Bei optimaler Vermarktung über spezialisierte Dressurpferde-Plattformen, professioneller Präsentation unter dem Sattel und gezielter Ansprache von Käufern, die explizit ein Ausbildungsprojekt mit Zuchtperspektive suchen, ist dieser Preis erzielbar. Die Kombination aus Stutenleistungsprüfung, befundfreier AKU und dem unkomplizierten Charakter rechtfertigt den Aufpreis.\n\n**Zielpreis (21.000 - 23.000 €):** Bei professioneller Vermarktung mit guten Fotos, Videos unter dem Sattel und transparenter Kommunikation der Stärken ist dieser Preisbereich bei einer Vermarktungsdauer von 2-4 Monaten realistisch.\n\n---\n\n### Preisfaktoren im Detail\n\n**Aufschlüsselung der wertbestimmenden Eigenschaften:**\n\n**Rasse: Deutsches Sportpferd (+)**\nDas Deutsche Sportpferd genießt national wie international einen soliden Ruf als vielseitiges Sportpferd. Die Zuchtverbände (Sachsen, Thüringen, Brandenburg-Anhalt) haben in den letzten Jahren durch gezielte Anpaarungen mit internationalen Blutlinien die Qualität kontinuierlich gesteigert. Im direkten Vergleich zu Hannoveranern oder Oldenburger liegt das Preisniveau etwa 10-15% niedriger, was für Käufer ein attraktives Preis-Leistungs-Verhältnis bedeutet.\n\n**Abstammung: Bernay x London Swing (++)**\n\n*Vater Bernay:*\nBernay (v. Belissimo M - Rohdiamant I) ist ein hochinteressanter Dressurvererber aus dem Gestüt Bonhomme. Belissimo M selbst war unter Isabell Werth bis Grand Prix erfolgreich und hat sich als einer der prägendsten Dressurvererber der letzten Dekade etabliert. Bernay vereint über Rohdiamant I zusätzlich das bewährte Rubinstein-Blut. Seine Nachkommen zeichnen sich durch überdurchschnittliche Rittigkeit, elastische Grundgangarten und ein unkompliziertes Temperament aus – Eigenschaften, die bei dieser Stute offensichtlich durchschlagen. Bernay-Nachkommen erzielen auf Auktionen regelmäßig Preise im oberen Segment.\n\n*Muttervater London Swing:*\nLondon Swing (v. Londonderry - Sandro Hit) bringt über Londonderry das legendäre Lauries Crusador xx-Blut und über Sandro Hit einen der erfolgreichsten Dressurvererber aller Zeiten in die Abstammung. Diese Kombination steht für Bewegungsqualität, Ausstrahlung und Rittigkeit. Londonderry-Nachkommen sind bekannt für ihre Kadenz im Trab und ihre natürliche Bergauf-Tendenz.\n\n*Gesamtbewertung Abstammung:*\nDie Kombination Bernay x London Swing ist züchterisch durchdacht und vereint moderne Dressurblutlinien mit bewährter Rittigkeit. Diese Abstammung rechtfertigt einen Preisaufschlag von ca. 2.000-3.000 € gegenüber durchschnittlichen Pedigrees.\n\n**Alter & Entwicklungsstand: 4 Jahre (+)**\nMit vier Jahren befindet sich die Stute im idealen Verkaufsalter für ein Ausbildungsprojekt. Sie ist alt genug, um charakterlich gefestigt zu sein und erste Ausbildungsschritte absolviert zu haben, aber jung genug, um dem Käufer die komplette sportliche Entwicklung zu ermöglichen. Das Stockmaß von 170 cm entspricht dem aktuellen Markttrend zu größeren, rahmigen Dressurpferden und ist für die Dressur optimal.\n\n**Ausbildungsstand: Angeritten (neutral)**\nDer Status \"angeritten\" bedeutet, dass die Grundlagen gelegt sind, aber noch erhebliche Ausbildungsarbeit vor dem Käufer liegt. Dies ist für den Preis ein neutraler bis leicht limitierender Faktor, da der Käufer das Ausbildungsrisiko trägt. Gleichzeitig bietet es die Chance, das Pferd nach eigenen Vorstellungen weiterzuentwickeln. Wertsteigerungspotenzial: Mit 6-12 Monaten professioneller Ausbildung und ersten A-Dressur-Platzierungen könnte der Wert auf 28.000-35.000 € steigen.\n\n**Gesundheit: AKU ohne Befund (++)**\nEine befundfreie Ankaufsuntersuchung ist ein erheblicher Wertfaktor und schafft Vertrauen beim Käufer. Bei einem vierjährigen Pferd mit dieser Größe ist dies keine Selbstverständlichkeit. Dieser Faktor rechtfertigt einen Aufpreis von ca. 1.500-2.500 € gegenüber Pferden ohne AKU oder mit Befunden.\n\n**Erfolge: Stutenleistungsprüfung 7,4 (+)**\nEine Gesamtnote von 7,4 in der Stutenleistungsprüfung liegt über dem Durchschnitt und dokumentiert solide Grundqualität. Für eine Staatsprämienanwartschaft wäre eine 7,5 erforderlich gewesen, dennoch signalisiert dieses Ergebnis überdurchschnittliche Veranlagung. Besonders wertvoll ist die offizielle Dokumentation der Qualitäten durch neutrale Richter – dies schafft Transparenz und Vertrauen.\n\n**Charakter & Rittigkeit: Brav und rittig (++)**\nDie Beschreibung als \"brav und rittig\" in Kombination mit \"unerschrocken\" deutet auf ein unkompliziertes, arbeitswilliges Pferd hin. Für die Zielgruppe der ambitionierten Amateure ist dies ein entscheidendes Kaufkriterium und rechtfertigt einen Aufpreis von 1.000-2.000 €.\n\n**Besondere Eigenschaften: Verladefromm, schmiedefromm, unerschrocken (+)**\nDiese Alltagstauglichkeit ist nicht zu unterschätzen. Pferde mit Verlade- oder Schmiedeproblemen sind deutlich schwerer zu vermarkten. Die Unerschrockenheit deutet auf ein stabiles Nervenkostüm hin, was für die weitere Ausbildung und spätere Turniereinsätze wertvoll ist.\n\n**Regionale Faktoren: PLZ 70619 – Raum Stuttgart (+)**\nDer Großraum Stuttgart gehört zu den kaufkräftigsten Pferderegionen Deutschlands mit hoher Dichte an ambitionierten Reitern und guter Infrastruktur. Die Nähe zu renommierten Ausbildungsställen und das gehobene Preisniveau der Region wirken sich positiv auf die Verkaufschancen aus. Käufer aus dieser Region sind tendenziell bereit, für Qualität angemessen zu zahlen.\n\n---\n\n### Verkaufsempfehlungen\n\n**Wertsteigerungspotenzial:**\n\n- **Weitere Ausbildung:** 2-3 Monate intensives Training unter einem erfahrenen Bereiter würde die Verkaufschancen erheblich verbessern. Ein Pferd, das sicher alle drei Grundgangarten zeigt und erste Lektionen (einfache Übergänge, Zirkel, Schlangenlinien) beherrscht, erzielt 3.000-5.000 € mehr.\n\n- **Videoerstellung:** Professionelle Videos in allen drei Gangarten, idealerweise in einer gepflegten Halle mit gutem Licht, sind heute unverzichtbar. Zusätzlich: Freilaufvideo zur Demonstration der natürlichen Bewegungsqualität.\n\n- **Turniereinsatz:** Bereits eine einzige A-Dressur-Platzierung würde den Wert um ca. 2.000-4.000 € steigern und die Vermarktung erheblich erleichtern.\n\n**Vermarktungsempfehlungen:**\n\n- **Primäre Kanäle:** ehorses.de (Premium-Anzeige), FN-Verkaufspferde, rimondo.com\n- **Zielgruppe:** Ambitionierte Amateure (35-55 Jahre) mit Turnierambitionen bis Klasse M, die ein Pferd selbst ausbilden möchten, oder junge Berufsreiter, die ein Verkaufsprojekt suchen\n- **Zusätzliche Vermarktung:** Aufgrund der Stutenleistungsprüfung auch für Züchter interessant – Bewerbung in Zuchtforen und bei Zuchtverbänden\n\n**Vorbereitung für Verkauf:**\n\n- Alle Papiere (Equidenpass, Abstammungsnachweis, AKU-Bericht, Stutenleistungsprüfungs-Protokoll) griffbereit halten\n- Aktueller Impfstatus und Wurmkur-Protokoll\n- Professionelle Präsentation: gepflegtes Erscheinungsbild, sauberer Stall, ordentliche Ausrüstung beim Probereiten\n- Flexibilität bei Probereitterminen erhöht die Verkaufschancen\n\n---\n\n### Kaufberatung\n\n**Wichtige Kaufaspekte:**\n\n- **Beim Probereiten:** Achten Sie auf die Losgelassenheit und Durchlässigkeit in allen drei Gangarten. Lassen Sie sich die Stute auch von einer anderen Person reiten, um das Verhalten bei Reiterwechsel zu beobachten. Testen Sie Übergänge und einfache Seitengänge, um die Rittigkeit zu überprüfen.\n\n- **Bei der Besichtigung:** Beobachten Sie das Verhalten beim Putzen, Satteln und Führen. Lassen Sie sich das Verladen demonstrieren. Prüfen Sie die Reaktion auf unbekannte Reize (Geräusche, Gegenstände).\n\n- **Interpretation der Preisspanne:** \n  - *Unteres Ende (18.000 €):* Gerechtfertigt bei schnellem Verkaufswunsch des Verkäufers, wenn das Pferd noch sehr roh ist oder wenn Sie als Käufer erhebliche Verhandlungsmacht haben\n  - *Oberes Ende (25.000 €):* Gerechtfertigt, wenn die Stute im Probereiten überzeugt, die Abstammung für Ihre Zuchtpläne interessant ist und Sie bereit sind, für Qualität und Sicherheit (befundfreie AKU) zu zahlen\n\n- **Preis-Leistungs-Verhältnis:** Bei einem Preis um 21.000 € erhalten Sie ein Pferd mit überdurchschnittlicher Abstammung, dokumentierter Qualität und gesundheitlicher Absicherung. Im Vergleich zu Auktionspferden ähnlicher Qualität (DSP-Auktion, Hannoveraner Auktion) liegt dieser Preis im marktüblichen Bereich, bietet aber den Vorteil der individuellen Besichtigung und des Probereitens.\n\n---\n\n### Fazit\n\nDiese Stute präsentiert sich als solides Dressurnachwuchspferd mit überdurchschnittlicher Abstammung und allen Voraussetzungen für eine erfolgreiche sportliche Karriere. Die Kombination aus befundfreier AKU, dokumentierter Qualität durch die Stutenleistungsprüfung und dem unkomplizierten Charakter macht sie zu einer sicheren Investition für Käufer, die ein Ausbildungsprojekt mit Entwicklungspotenzial suchen. Bei entsprechender Förderung ist mittelfristig eine Wertsteigerung auf 30.000 € und mehr realistisch.\n\nDer angegebene Marktwert von 18.000 - 25.000 € dient als Orientierungsrahmen und kann je nach individueller Verhandlungssituation, Vermarktungsaufwand und aktuellem Marktgeschehen variieren.\n\n---\n\n*Ergebnis erstellt durch die PferdeWert-KI – keine rechtsverbindliche Bewertung.*",
      "usage": {
        "prompt_tokens": 1552,
        "completion_tokens": 3596,
        "total_tokens": 5148
      },
      "success": true
    }
  }
}